ID,빌라명,룸타입,수용인원,주요시설,체크인체크아웃,최소숙박,vn업체주소,kr업체주소,공항거리,해변거리,연락처,카카오ID,이메일,홍보문구,특별혜택,언어지원,청소서비스,조식제공,픽업서비스,주변관광지,만족도평가,계약상태,광고섹션
5,하얏트 리젠시 다낭 풀빌라,"1베드룸,2베드룸,3베드룸",2~6명,"개인수영장,자쿠지,바베큐그릴,주방시설,세탁기,넷플릭스,와이파이",14:00 / 12:00,2박 이상,"5 Trường Sa, Hoà Hải, Ngũ Hành Sơn, Đà Nẵng",다낭시 응우한선구 호아하이동 쯔엉사 5번지,공항에서 25분,논느억 비치 앞,+84-236-3911-234,hyattdanang,hyatt.danang@hyatt.com,세계적인 하얏트 브랜드의 프리미엄 풀빌라,"EchoPal 예약시 조식 무료, 공항 픽업 포함","한국어,영어,베트남어",매일,있음,있음,"한시장 15분, 바나힐 30분",4.8,계약중,프리미엄
6,프리미어 빌리지 다낭 (아코르 매니지드),"1베드룸,2베드룸,3베드룸,5베드룸",2~10명,"개인수영장,자쿠지,바베큐그릴,주방시설,발코니/테라스",15:00 / 12:00,2박 이상,"99 Võ Nguyên Giáp, Khuê Mỹ, Ngũ Hành Sơn, Đà Nẵng",다낭시 응우한선구 쿠에미동 보응우옌잡 99번지,공항에서 20분,미케비치 도보 5분,+84-236-3919-999,premiervillage,info@premiervillage-danang.com,유럽풍 럭셔리 빌라로 가족여행 최적,"3박 이상 15% 할인, 키즈클럽 무료","한국어,영어,중국어",격일,있음,있음,"빅C 10분, 미케비치 5분",4.7,계약중,VIP
7,디 오션 빌라스,"2베드룸,3베드룸,4베드룸",4~8명,"개인수영장,바베큐그릴,주방시설,프라이빗비치",14:00 / 11:00,3박 이상,"Truong Sa Street, Hoa Hai Ward, Ngu Hanh Son, Da Nang",다낭시 응우한선구 호아하이동 쯔엉사,공항에서 30분,프라이빗 비치 보유,+84-236-3847-333,oceanvillas,contact@theoceanvillas.com,한적하고 조용한 프라이빗 휴양지,"장기투숙 20% 할인, 매일 청소 서비스","한국어,영어",매일,없음,있음,"마블마운틴 10분, 호이안 25분",4.5,계약중,일반
8,빈펄 리조트 다낭,"풀빌라 1베드,풀빌라 2베드,풀빌라 3베드",2~8명,"개인수영장,자쿠지,바베큐그릴,주방시설,세탁기,발코니",14:00 / 12:00,2박 이상,"Trường Sa, Hoà Hải, Ngũ Hành Sơn, Đà Nẵng",다낭시 응우한선구 호아하이동 쯔엉사,공항에서 20분,논느억 비치 앞,+84-236-3968-888,vinpearldanang,reservation@vinpearl.com,전 객실 독채 풀빌라의 프라이빗 천국,"EchoPal 10% 할인, 스파 20% 할인","한국어,영어,베트남어",매일,있음,있음,"한시장 20분, 오행산 15분",4.6,계약중,프리미엄
9,나만 리트리트,"가든 풀빌라,오션뷰 풀빌라",2~4명,"개인수영장,자쿠지,주방시설,넷플릭스,와이파이",15:00 / 11:00,2박 이상,"Võ Nguyên Giáp, Ngũ Hành Sơn, Đà Nẵng",다낭시 응우한선구 보응우옌잡,공항에서 15분,해변 도보 3분,+84-236-3955-555,namanretreat,info@namanretreat.com,화이트&우드 감성의 세련된 풀빌라,"장기투숙 할인, 요가클래스 무료","한국어,영어",격일,있음,있음,"미케비치 3분, 한시장 10분",4.9,계약중,VIP